<?xml version="1.0" encoding="UTF-8"?>

<!DOCTYPE InterfaceSpec SYSTEM "InterfaceSpecCSV.dtd">

<InterfaceSpec Name="Test0026">
      <Header Name="EmployeesHeader">
                  <Field Name="Full name"/>
                  <Field Name="Rank in company"/>
                  <Field Name="Working location"/>
      </Header>
      <Records>
            <Record Name="Employee">
                  <Field Name="Name"/>
                  <Field Name="Rank"/>
                  <Field Name="Location"/>
            </Record>
    </Records>
</InterfaceSpec>
